Symbol,Ticker,Name,Market Cap (Original),Original Currency,Market Cap (EUR),Market Cap (USD),Exchange,Active,Description,Homepage URL,Employees,Timestamp
RMS.PA,RMS.PA,Hermès International Société en commandite par actions,257166034268,EUR,257166034268,289308172199,EUR,true,"Hermès International Société en commandite par actions engages in the production, wholesale, and retail of various goods. The company offers leather goods and saddlery, such as bags for men and women, clutches, briefcases, luggage, small leather goods, diaries and writing objects, saddles, bridles, and a range of equestrian products and clothing; ready-to-wear garments for men and women; and accessories, including jewelry, belts, hats, gloves, the Internet of Things products, and shoes. It also provides silk and textiles for men and women; art of living and tableware products; perfumes; and watches. In addition, the company is also involved in weaving, engraving, printing, dyeing, finishing, and producing textiles; and purchasing, tanning, dyeing, finishing, and selling precious leathers. It sells its products through a network of 303 stores worldwide. The company also sells watches, perfumes, and tableware through a network of specialized stores. Hermès International Société en commandite par actions was founded in 1837 and is based in Paris, France. Hermès International Société en commandite par actions operates as a subsidiary of H51 SAS.",https://finance.hermes.com,24203,
MC.PA,MC.PA,"LVMH Moët Hennessy - Louis Vuitton, Société Européenne",247465073249,EUR,247465073249,278394727471,EUR,true,"LVMH Moët Hennessy - Louis Vuitton, Société Européenne operates as a luxury goods company worldwide. The company offers champagnes, wines, and spirits under the Clos des Lambrays, Château d'Yquem, Dom Pérignon, Ruinart, Moët & Chandon, Hennessy, Veuve Clicquot, Ardbeg, Château Cheval Blanc, Glenmorangie, Krug, Mercier, Chandon, Cape Mentelle, Newton Vineyard, Cloudy Bay, Belvedere, Terrazas de los Andes, Bodega Numanthia, Cheval des Andes, Woodinville, Ao Yun, Clos19, and Volcan de mi Tierra brands. It also provides fashion and leather products under the Berluti, Celine, Christian Dior, Emilio Pucci, FENDI, Givenchy, Kenzo, Loewe, Loro Piana, Louis Vuitton, Marc Jacobs, Moynat, Patou, and RIMOWA brands. In addition, the company offers perfumes and cosmetics under the Acqua di Parma, Benefit Cosmetics, Cha Ling, Fenty Beauty by Rihanna, Fresh, Givenchy Parfums, Guerlain, KVD Beauty, Kenzo Parfums, Maison Francis Kurkdjian, Make Up For Ever, Marc Jacobs Beauty, Officine Universelle Buly, Parfums Christian Dior, and Perfumes Loewe brands; watches and jewelry under the Bulgari, Chaumet, Fred, Hublot, Repossi, TAG Heuer, Tiffany & Co., and Zenith brands; and custom-designed yachts under the Feadship brand name, as well as designs and builds luxury yachts under the Royal Van Lent brand. Further, it provides daily newspapers under the Les Échos brand; Belmond, a luxury tourism service; home other activities under the Belmond, Cheval Blanc, Connaissance des Arts, Cova, Investir, Jardin d'Acclimatation, La Samaritaine, Le Parisien, and Radio Classique brands; and selective retailing products under the DFS, La Grande Epicerie de Paris, Le Bon Marché Rive Gauche, Sephora, and Starboard Cruise Services brands, as well as operates Jardin d'Acclimatation, a leisure and amusement park. The company operates 5,556 stores. LVMH Moët Hennessy - Louis Vuitton, Société Européenne was incorporated in 1923 and is headquartered in Paris, France.",https://www.lvmh.com,200518,
ITX.MC,ITX.MC,"Industria de Diseño Textil, S.A.",144695381165,EUR,144695381165,162780269057,EUR,true,"Industria de Diseño Textil, S.A. engages in the retail and online distribution of clothing, footwear, accessories, and household textile products through various retail concepts. The company sells its products under the Zara, Pull & Bear, Massimo Dutti, Bershka, Stradivarius, Oysho, and Zara Home brands. It is also involved in the textile manufacturing, logistics, design, insurance, construction, and real estate businesses, as well as provides financial services. The company operates in Spain, rest of Europe, the Americas, and internationally. Industria de Diseño Textil, S.A. was founded in 1963 and is headquartered in A Coruña, Spain.",https://www.inditex.com,67195,
TJX,TJX,"The TJX Companies, Inc.",143022369000,USD,127132583804,143022369000,USD,true,"The TJX Companies, Inc., together with its subsidiaries, operates as an off-price apparel and home fashions retailer. It operates through four segments: Marmaxx, HomeGoods, TJX Canada, and TJX International. The company sells family apparel, including footwear and accessories; home fashions, such as home basics, furniture, rugs, lighting products, giftware, soft home products, decorative accessories, tabletop, and cookware, as well as expanded pet, kids, and gourmet food departments; jewelry and accessories; and other merchandise. As of February 23, 2022, it operated 1,284 T.J. Maxx, 1,148 Marshalls, 850 HomeGoods, 59 Sierra, and 39 Homesense stores, as well as tjmaxx.com, marshalls.com, and sierra.com in the United States; 293 Winners, 147 HomeSense, and 106 Marshalls stores in Canada; 618 T.K. Maxx and 77 Homesense stores, as well as tkmaxx.com in Europe; and 68 T.K. Maxx stores in Australia. The company was incorporated in 1962 and is headquartered in Framingham, Massachusetts.",https://www.tjx.com,364000,
EL.PA,EL.PA,EssilorLuxottica SA,110660447016,EUR,110660447016,124491446749,EUR,true,"EssilorLuxottica Société anonyme designs, manufactures, and distributes ophthalmic lenses, frames, and sunglasses in North America, Europe, Latin America, Asia, Oceania, and Africa. It operates in five segments: Wholesale, Retail, Lenses and Optical Instruments, Equipment, and Sunglasses and Readers. The Wholesale segment engages in the manufacture and wholesale distribution of luxury and sports eyewear. The Retail segment retails luxury and sports eyewear. The Lenses and Optical Instruments segment offers lenses and small equipment, including Varilux progressive lenses; Crizal antireflective, anti-smudge, and antistatic lenses; Transitions photochromic lenses; Eyezen lenses for users of computers, tablets, smartphones, and other connected devices; Xperio polarized sun lenses; and Nikon and Kodak corrective lens brands. It also provides lens edging and mounting instruments for opticians and prescription laboratories; optometry instruments for eye care professionals, schools, occupational medicine centers, military, and other institutions; and Transitions Signature Gen 8 photochromic lens, as well as develops solutions for online sales of optical products. The Equipment segment offers digital surfacing machines and lens coating machines to prescription laboratories, integrated optical chains, and lens manufacturers. The Sunglasses and Readers segment provides non-prescription sunglasses and reading glasses under the Foster Grant, Gargoyles, Magnivision, Corinne McCormack, Monkey Monkey, Ryders Eyewear, and SolarShield brands; Reebok, Steve Madden, Betsey Johnson, Nine West, Dockers, French Connection, Ironman, Rawlings, Bodyglove, Panama Jack, Marvel, and Disney; Bolon, Molsion, Qina, and Prosun brands; and Mujosh and Aojo brands. It has a network of 490 prescription laboratories and edging-mounting facilities. The company was formerly known as Essilor International Société Anonyme and changed its name to EssilorLuxottica Société anonyme in October 2018. EssilorLuxottica Société anonyme was founded in 1849 and is headquartered in Paris, France.",https://www.essilorluxottica.com,153498,
9983.T,9983.T,"Fast Retailing Co., Ltd.",14949901259920,JPY,91433596105,102846006933,JPY,true,"Fast Retailing Co., Ltd., through its subsidiaries, operates as an apparel designer and retailer in Japan and internationally. The company operates through four segments: UNIQLO Japan, UNIQLO International, GU, and Global Brands. It manufactures and retails clothing for men, women, children, and babies; and lingerie, as well as other goods and items. The company operates stores and franchises under the UNIQLO, GU, PLST, Theory, COMPTOIR DES COTONNIERS, J Brand, and PRINCESSE TAM.TAM brand names. It also sells its products through online; and provides real estate leasing services. The company was formerly known as Ogori Shoji Co., Ltd. and changed its name to Fast Retailing Co., Ltd. in September 1991. Fast Retailing Co., Ltd. was founded in 1949 and is headquartered in Yamaguchi, Japan.",https://www.fastretailing.com,60454,
CFR.SW,CFR.SW,Compagnie Financière Richemont SA,83936128030,CHF,89705060468,101025622297,CHF,true,"Compagnie Financière Richemont SA engages in the luxury goods business in Europe, the Middle East, Africa, Asia, and the Americas. The company operates through Jewellery Maisons, Specialist Watchmakers, and Online Distributors segments. It designs, manufactures, and distributes jewelry products; and precision timepieces, watches, and writing instruments, as well as clothing, and leather goods and accessories. The company offers its products under the Cartier, Van Cleef & Arpels, Buccellati, A. Lange & Söhne, Baume & Mercier, IWC Schaffhausen, Jaeger LeCoultre, Panerai, Piaget, Roger Dubuis, Vacheron Constantin, Watchfinder & Co., YOOX, NET-A-PORTER, MR PORTER, The Outnet, Alaïa, Chloé, Montblanc, Peter Millar, Purdey, Serapian, TIMEVALLEE, dunhill, Delvaux, and AZ Factory brands through own boutiques and online stores. Compagnie Financière Richemont SA was incorporated in 1979 and is headquartered in Bellevue, Switzerland.",https://www.richemont.com,37117,
CDI.PA,CDI.PA,Christian Dior SE,82880842802,EUR,82880842802,93239782654,EUR,true,"Christian Dior SE, through its subsidiaries, engages in the production, distribution, and retail of fashion and leather goods, wines and spirits, perfumes and cosmetics, and watches and jewelry worldwide. The company offers its fashion and leather goods under the Louis Vuitton, Christian Dior Couture, Loewe, Marc Jacobs, Celine, Kenzo, Givenchy, Pink Shirtmaker, Emilio Pucci, Berluti, Loro Piana, Rimowa brand names; wines and spirits under the Hennessy, Glenmorangie, Ardbeg, a Belvedere, Volcán de mi Tierra, Moët & Chandon, Dom Pérignon, Veuve Clicquot, Krug, Château d'Yquem, Ruinart, Belvedere, Glenmorangie, Newton Vineyards, Bodega Numanthia, and Château d'Esclans brand names; and perfumes and cosmetics under the Parfums Christian Dior, Guerlain, Parfums Givenchy, Make Up For Ever, Benefit Cosmetics, Fresh, Acqua di Parma, KVD Vegan Beauty, Fenty, Ole Henriksen, and Maison Francis Kurkdjian brand names. It also provides watches and jewelry under the Tiffany, Bvlgari, TAG Heuer, Zenith, Hublot, Chaumet, and Fred brand names. In addition, the company operates retail stores under the DFS Galleria, Sephora, Le Bon Marché, and Ile de Beauté names; publishes Le Parisien- Aujourd'hui en France, a daily newspaper; designs and builds yachts; and operates the Cova pastry shops. Further, it is involved in real estate activities under the La Samaritaine brand name; and hotel business. The company sells its products through store network, including e-commerce websites; and agents and distributors. As of December 31, 2021, it operated 5,556 stores. The company was incorporated in 1946 and is headquartered in Paris, France. Christian Dior SE was formerly a subsidiary of Semyrhamis SA.",https://www.dior-finance.com,195831,
CTAS,CTAS,Cintas Corporation,86709220380,USD,77075825995,86709220380,USD,true,"Cintas Corporation provides corporate identity uniforms and related business services primarily in the United States, Canada, and Latin America. It operates through Uniform Rental and Facility Services, First Aid and Safety Services, and All Other segments. The company rents and services uniforms and other garments, including flame resistant clothing, mats, mops and shop towels, and other ancillary items; and provides restroom cleaning services and supplies, as well as sells uniforms. It also offers first aid and safety services, and fire protection products and services. The company provides its products and services through its distribution network and local delivery routes, or local representatives to small service and manufacturing companies, as well as major corporations. Cintas Corporation was founded in 1968 and is headquartered in Cincinnati, Ohio.",https://www.cintas.com,46500,
NKE,NKE,"NIKE, Inc.",86116777002,USD,76549203077,86116777002,USD,true,"NIKE, Inc., together with its subsidiaries, designs, develops, markets, and sells men's, women's, and kids athletic footwear, apparel, equipment, and accessories worldwide. The company provides athletic and casual footwear, apparel, and accessories under the Jumpman trademark; and casual sneakers, apparel, and accessories under the Converse, Chuck Taylor, All Star, One Star, Star Chevron, and Jack Purcell trademarks. In addition, it sells a line of performance equipment and accessories comprising bags, socks, sport balls, eyewear, timepieces, digital devices, bats, gloves, protective equipment, and other equipment for sports activities under the NIKE brand; and various plastic products to other manufacturers. The company markets apparel with licensed college and professional team, and league logos, as well as sells sports apparel. Additionally, it licenses unaffiliated parties to manufacture and sell apparel, digital devices, and applications and other equipment for sports activities under NIKE-owned trademarks. The company sells its products to footwear stores; sporting goods stores; athletic specialty stores; department stores; skate, tennis, and golf shops; and other retail accounts through NIKE-owned retail stores, digital platforms, independent distributors, licensees, and sales representatives. The company was formerly known as Blue Ribbon Sports, Inc. and changed its name to NIKE, Inc. in 1971. NIKE, Inc. was founded in 1964 and is headquartered in Beaverton, Oregon.",https://investors.nike.com,79400,
ROST,ROST,"Ross Stores, Inc.",46786501520,USD,41588521201,46786501520,USD,true,"Ross Stores, Inc., together with its subsidiaries, operates off-price retail apparel and home fashion stores under the Ross Dress for Less and dd's DISCOUNTS brand names. Its stores primarily offer apparel, accessories, footwear, and home fashions. The company's Ross Dress for Less stores sell its products at department and specialty stores primarily to middle income households; and dd's DISCOUNTS stores sell its products at department and discount stores for households with moderate income. As of July 5, 2022, it operated approximately 1,950 stores under the Ross Dress for Less and dd's DISCOUNTS name in 40 states, the District of Columbia, and Guam. Ross Stores, Inc. was incorporated in 1957 and is headquartered in Dublin, California.",https://www.rossstores.com,107000,
ADS.DE,ADS.DE,adidas AG,37316758556,EUR,37316758556,41980828615,EUR,true,"adidas AG, together with its subsidiaries, designs, develops, distributes, and markets athletic and sports lifestyle products worldwide. It offers footwear; apparel; and accessories and gear, such as bags and balls under the adidas brand. It sells its products through approximately 2,200 own-retail stores; mono-branded franchise stores and shop-in-shops; and wholesale and its e-commerce channels. The company was formerly known as adidas-Salomon AG and changed its name to adidas AG in June 2006. adidas AG was founded in 1920 and is headquartered in Herzogenaurach, Germany.",https://www.adidas-group.com,46045,
VIPS,VIPS,Vipshop Holdings Limited,35604159989,USD,31648537814,35604159989,USD,true,"Vipshop Holdings Limited operates online platforms for various brands in the People's Republic of China. It operates in Vip.com, Shan Shan Outlets, and Others segments. The company offers women's apparel, such as casual wear, jeans, dresses, outerwear, lingerie, pajamas, and maternity clothes; men's apparel comprising casual and smart-casual T-shirts, polo shirts, jackets, pants, and underwear; and skin care and cosmetic products, including cleansers, lotions, face and body creams, face masks, sunscreen, foundations, lipsticks, eye shadows, and other cosmetics-related items. It also provides shoes and bags, which comprises casual and formal shoes, purses, satchels, luggage, duffel bags, and wallets; handbags; apparel, gears and accessories, furnishings and decor, toys, and games for boys, girls, infants, and toddlers; sportswear, sports gear, and footwear for various sporting activities; home furnishings, such as bed and bath products, home decor, kitchen and tabletop items, and home appliances; and consumer electronic products. In addition, the company offers food and snacks, beverages, fresh produce, and pet goods; beauty products; and internet finance services, including consumer and supplier financing, and microcredit. Vipshop Holdings Limited provides its branded products through its vip.com and vipshop.com online platforms, as well as through its internet website and cellular phone application. Further, it offers warehousing, logistics, product procurement, research and development, technology development, and consulting services; software development and information technology support solutions; and supply chain services. Vipshop Holdings Limited was founded in 2008 and is headquartered in Guangzhou, the People's Republic of China.",https://www.vip.com,14966,
LULU,LULU,Lululemon Athletica Inc.,32183341950,USD,28607772659,32183341950,USD,true,"lululemon athletica inc., together with its subsidiaries, designs, distributes, and retails athletic apparel and accessories for women and men. It operates in two segments, Company-Operated Stores and Direct to Consumer. The company offers pants, shorts, tops, and jackets for healthy lifestyle and athletic activities, such as yoga, running, and training, as well as other sweaty pursuits. It also provides fitness-related accessories and footwear. The company sells its products through a chain of company-operated stores; outlets and warehouse sales; interactive workout platform; a network of wholesale accounts, such as yoga studios, health clubs, and fitness centers; temporary locations; and license and supply arrangements, as well as directly to consumer through mobile apps and lululemon.com e-commerce website. As of January 30, 2022, it operated 574 company-operated stores under the lululemon brand in the United States, Canada, the People's Republic of China, Australia, the United Kingdom, Japan, New Zealand, Germany, South Korea, Singapore, France, Malaysia, Sweden, Ireland, the Netherlands, Norway, and Switzerland. lululemon athletica inc. was founded in 1998 and is based in Vancouver, Canada.",https://www.lululemon.com,39000,
KER.PA,KER.PA,Kering SA,21813332717,EUR,21813332717,24539692560,EUR,true,"Kering SA develops, designs, manufactures, markets, and sells apparel and accessories. The company offers shoes; leather goods, including handbags and wallets, purses, and other leather products; eyewear, textile accessories, etc.; and jewelry and watches, as well as ready-to-wear products for men and women. It also provides perfumes and cosmetics. The company provides Gucci, Saint Laurent, Bottega Veneta, Alexander McQueen, Balenciaga, Brioni, Boucheron, Pomellato, DoDo, Qeelin, Girard-Perregaux, Ulysse Nardin, and Kering Eyewear branded products. It sells its products through stores and e-commerce sites. As of December 31, 2021, it operated 1,565 stores. Kering SA sells its products in the Asia-Pacific, Western Europe, North America, Japan, and internationally. The company was formerly known as PPR SA and changed its name to Kering SA in June 2013. Kering SA was founded in 1963 and is based in Paris, France.",https://www.kering.com,44627,
HM-B.ST,HM-B.ST,H & M Hennes & Mauritz AB (publ),223786036590,SEK,20477859054,23080124028,SEK,true,"H & M Hennes & Mauritz AB (publ) provides clothing, accessories, footwear, cosmetics, home textiles, and homeware for women, men, teenagers, children, and babies worldwide. It offers sportswear, shoes, bags, beauty products, and ready-to-wear; and interior products, including bed linens, dinnerware, textiles, furniture, and lighting. The company provides its products under the H&M, H&M HOME, COS, & Other Stories, Monki, Weekday, ARKET, Afound, Singular Society, Treadler, Creator Studio, and Sellpy brands. As of November 30, 2021, the company had 54 online markets and approximately 4,801 stores in 75 markets, including franchise markets. H & M Hennes & Mauritz AB (publ) was founded in 1947 and is headquartered in Stockholm, Sweden.",https://www.hmgroup.com,140000,
DECK,DECK,Deckers Outdoor Corporation,18375278180,USD,16333784774,18375278180,USD,true,"Deckers Outdoor Corporation, together with its subsidiaries, designs, markets, and distributes footwear, apparel, and accessories for casual lifestyle use and high-performance activities. The company offers premium footwear, apparel, and accessories under the UGG brand name; sandals, shoes, and boots under the Teva brand name; and relaxed casual shoes and sandals under the Sanuk brand name. It also provides footwear and apparel for ultra-runners and athletes under the Hoka brand name; and fashion casual footwear using other plush materials under the Koolaburra brand. The company sells its products through department stores, domestic independent action sports and outdoor specialty footwear retailers, and larger national retail chains, as well as online retailers. It also sells its products directly to consumers through its retail stores and e-commerce websites, as well as distributes its products through distributors and retailers in the United States, Europe, the Asia-Pacific, Canada, Latin America, and internationally. As of March 31, 2022, it had 149 retail stores, including 75 concept stores and 74 outlet stores worldwide. The company was founded in 1973 and is headquartered in Goleta, California.",https://www.deckers.com,4800,
MONC.MI,MONC.MI,Moncler S.p.A.,14731817316,EUR,14731817316,16573087316,EUR,true,"Moncler S.p.A., together with its subsidiaries, designs, produces, and distributes clothing and related accessories for men, women, and children under the Moncler and Stone Island brand names. Its product portfolio includes footwear products; leather goods, such as bags, backpacks, and accessories; and sunglasses, eyeglasses, frames, and men's and women's ski goggles under the Moncler Lunettes brand. The company also offers perfume for men and women. As of December 31, 2021, it operated 237 retail directly operated stores and 64 wholesale shop-in-shops. The company also sells its products through moncler.com, an online store. It serves in Italy, other European countries, Japan, the rest of Asia, and the Americas. The company was formerly known as Moncler S.r.l. and changed its name to Moncler S.p.A. in October 2013. Moncler S.p.A. was founded in 1952 and is headquartered in Milan, Italy.",https://www.monclergroup.com,7354,
1913.HK,1913.HK,Prada S.p.A.,128324823000,HKD,14661111027,16497586007,HKD,true,"Prada S.p.A., together with its subsidiaries, designs, produces, and distributes leather goods, handbags, footwear, apparel, and accessories in Europe, the Americas, the Asia Pacific, Japan, the Middle East, and Africa. It offers its products under the Prada, Miu Miu, Church's, and Car Shoe brands. The company also provides eyewear and fragrances under licensing agreements, as well as operates in the food sector under the Marchesi 1824 brand. As of December 31, 2021, it had 635 directly operated stores. The company also sells its products through a network of approximately 26 franchise operated stores; multi-brand stores; luxury department stores; independent retailers; and online retailers. In addition, it engages in the event management and real estate business, as well as operates duty-free stores. The company was founded in 1913 and is headquartered in Milan, Italy. Prada S.p.A. is a subsidiary of Prada Holding S.p.A.",https://www.pradagroup.com,15216,
