Symbol,Ticker,Name,Market Cap (Original),Original Currency,Market Cap (EUR),Market Cap (USD),Exchange,Active,Description,Homepage URL,Employees,Timestamp
URBN,URBN,"Urban Outfitters, Inc.",4801682656,USD,4268215712,4801682656,USD,true,"Urban Outfitters, Inc. engages in the retail and wholesale of general consumer products. The company operates through three segments: Retail, Wholesale, and Nully. It operates Urban Outfitters stores, which offer women's and men's fashion apparel, activewear, intimates, footwear, accessories, home goods, electronics, and beauty products for young adults aged 18 to 28; and Anthropologie stores that provide women's casual apparel, accessories, intimates, shoes, and home furnishings, as well as gifts, decorative items, and beauty and wellness products for women aged 28 to 45. The company also operates Bhldn stores, which offer heirloom quality wedding gowns, bridesmaid frocks, party dresses, assorted jewelry, headpieces, footwear, lingerie, and decorations; and Terrain stores that provide lifestyle home products, garden and outdoor living products, antiques, live plants, flowers, wellness products, and accessories. In addition, it operates Free People retail stores, which offer casual women's apparel, intimates, activewear, shoes, accessories, home products, gifts, and beauty and wellness products for young women aged 25 to 30; restaurants; and women's apparel subscription rental service under the Nuuly brand name. The company serves its customers directly through retail stores, Websites, mobile applications, catalogs and customer contact centers, franchised or third-party operated stores, and digital businesses. As of January 31, 2022, it operated 261 Urban Outfitters, 238 Anthropologie Group, and 173 Free People stores in the United States, Canada, and Europe; and 10 restaurants, as well as two Urban Outfitters and one Anthropologie franchisee-owned stores. The company is also involved in the wholesale of young women's contemporary casual apparel, intimates, activewear, and shoes under the Free People brand; and home goods through department and specialty stores worldwide. The company was founded in 1970 and is based in Philadelphia, Pennsylvania.",https://www.urbn.com,11310,
JWN,JWN,"Nordstrom, Inc.",4078861650,USD,3625700120,4078861650,USD,true,"Nordstrom, Inc., a fashion retailer, provides apparels, shoes, beauty, accessories, and home goods for women, men, young adults, and children. It offers a range of brand name and private label merchandise through various channels, such as Nordstrom branded stores and online at Nordstrom.com; TrunkClub.com; Nordstrom.ca; Nordstrom stores; Nordstrom Rack stores; Nordstrom Locals; Nordstromrack.com and HauteLook; clearance stores under the Last Chance name; Trunk Club clubhouses; and Jeffrey boutiques. As of December 31, 2021, the company operated 94 Nordstrom stores and 240 Nordstrom Rack stores in the United States; 2 clearance stores; and 7 Nordstrom Local service hubs, as well as 6 Nordstrom stores and 7 Nordstrom Rack stores in Canada. Nordstrom, Inc. was founded in 1901 and is headquartered in Seattle, Washington.",https://press.nordstrom.com,55000,
ATZ.TO,ATZ.TO,Aritzia Inc.,5590583725,CAD,3564423073,4011612891,CAD,true,"Aritzia Inc., together with its subsidiaries, designs and sells apparels and accessories for women in North America. It offers t-shirts and tops, bodysuits, shirts and blouses, sweaters, jumpsuits and rompers, shirt jackets, skirts, bodysuits, activeware, knitwear, sweatsuits, pants, denims, leggings, bike shorts, dresses, jackets, blazers, jackets and coats, and shoes, as well as accessories, including hats, socks, face masks, intimates, gloves and mittens, belts, scarves, scrunchies, bags, and iphone cases. The company offers its products under the Wilfred, Super World, Babaton, and TNA brands. As of February 27, 2022, it operates approximately 105 boutiques. In addition, it sells its products through online at aritzia.com. The company was formerly known as Aritzia Capital Corporation and changed its name to Aritzia Inc. in August 2016. Aritzia Inc. was founded in 1984 and is headquartered in Vancouver, Canada.",https://www.aritzia.com,8300,
PVH,PVH,PVH Corp.,3918817205,USD,3483436613,3918817205,USD,true,"PVH Corp. operates as an apparel company worldwide. The company operates through six segments: Tommy Hilfiger North America, Tommy Hilfiger International, Calvin Klein North America, Calvin Klein International, Heritage Brands Wholesale, and Heritage Brands Retail. It designs, markets, and retails men's, women's, and children's apparel and accessories, including branded dress shirts, neckwear, sportswear, jeans wear, performance apparel, intimate apparel, underwear, swimwear, swim-related products, handbags, accessories, footwear, outerwear, home furnishings, luggage products, sleepwear, loungewear, hats, scarves, gloves, socks, watches and jewelry, eyeglasses and non-ophthalmic sunglasses, fragrance, home bed and bath furnishings, small leather goods, and other products. The company offers its products under its own brands, such as Tommy Hilfiger, Calvin Klein, Van Heusen, IZOD, ARROW, Warner's, Olga, Geoffrey Beene, and True&Co., as well as various other owned, licensed, and private label brands. It also licenses its own brands over various products. The company distributes its products at wholesale in department, chain, and specialty stores, as well as through warehouse clubs, mass market, and off-price and independent retailers; and through company-operated full-price, outlet stores, and concession locations, as well as through digital commerce sites. It markets its products to approximately 40 countries. PVH Corp. was founded in 1881 and is based in New York, New York.",https://www.pvh.com,16000,
KTB,KTB,"Kontoor Brands, Inc.",3808178356,USD,3385089740,3808178356,USD,true,"Kontoor Brands, Inc., a lifestyle apparel company, designs, manufactures, procures, markets, and distributes denim, apparel, and accessories under the Wrangler, Lee, and Rock & Republic brands in the United States and internationally. It operates through two segments, Wrangler and Lee. The company sells its products primarily through mass merchants, specialty stores, mid-tier and traditional department stores, company-operated stores, and online. As of January 1, 2022, it operated 80 retail stores across the Americas, Europe, the Middle East, Africa, and the Asia-Pacific regions. The company was incorporated in 2018 and is headquartered in Greensboro, North Carolina.",https://www.kontoorbrands.com,13200,
PUM.DE,PUM.DE,PUMA SE,3358962578,EUR,3358962578,3778785665,EUR,true,"PUMA SE, together with its subsidiaries, designs, develops, sells, and markets footwear, apparel, and accessories for men, women, and kids in Europe, the Middle East, Africa, the Americas, Greater China, and the Asia Pacific. The company offers performance and sport-inspired lifestyle products in categories, such as football, cricket, handball, rugby, volleyball, running, training and fitness, golf, and motorsports. It also issues licenses to independent partners to design, develop, manufacture, and sell watches, glasses, safety shoes, and gaming accessories, such as the Playseat. The company sells its products through PUMA retail stores and factory outlets, as well as through online stores. It offers its products primarily under the PUMA and Cobra Golf brand names. The company was founded in 1924 and is headquartered in Herzogenaurach, Germany.",https://www.puma.com,17303,
COLM,COLM,Columbia Sportswear Company,3645547696,USD,3240527346,3645547696,USD,true,"Columbia Sportswear Company, together with its subsidiaries, designs, sources, markets, and distributes outdoor, active, and everyday lifestyle apparel, footwear, accessories, and equipment in the United States, Latin America, the Asia Pacific, Europe, the Middle East, Africa, and Canada. The company provides apparel, accessories, and equipment that are used in various activities, such as skiing, snowboarding, hiking, climbing, mountaineering, camping, hunting, fishing, trail running, water sports, yoga, golf, and adventure travel. It also offers footwear products that include lightweight hiking boots, trail running shoes, rugged cold weather boots for activities on snow and ice, sandals and shoes for use in water activities, and function-first fashion footwear and casual shoes for everyday use. The company sells its products under the Columbia, Mountain Hardwear, SOREL, and prAna brand names through the company owned network of branded and outlet retail stores, brand-specific e-commerce sites, and concession-based arrangements with third-parties at branded outlet and shop-in-shop retail locations, as well as through independently operated specialty outdoor and sporting goods stores, sporting goods chains, department store chains, Internet retailers, and international distributors. As of December 31, 2021, it operated approximately 455 retail stores. The company was founded in 1938 and is headquartered in Portland, Oregon.",https://www.columbia.com,9780,
ABFRL.NS,ABFRL.NS,Aditya Birla Fashion and Retail Limited,309305540630,INR,3218809759,3623584398,INR,true,"Aditya Birla Fashion and Retail Limited designs, manufactures, distributes, and retails fashion apparel and accessories in India and internationally. It operates in two segments, Madura Fashion & Lifestyle, and Pantaloons. The company offers shirts, trousers, denims, t-shirts, dresses, suits and blazers, casuals, ceremonial, and party wear; shorts, joggers, track pants, sweatshirts, jackets, loungewear, biker t-shirts, polos, chinos, kurtas and bottom wear, occasion wear, festive ensembles, streetwear, classic shirts, logo T-shirts, casual pants, lehengas and kurta sets, ethnic bottom wear, athleisure wear, workwear, tops, sleepwear, crops tops, skirts, jeans, sportswear; accessories; and shawls, stoles, shoes, and lingerie, as well as home furnishings, footwear, handbags, bed linen, towels, smart table linen, dressy cushion covers, and others. It markets its products primarily under the Louis Philippe, Van Heusen, Allen Solly, and Peter England brands, as well as operates fashion store under the Pantaloons brand. The company also holds online and offline rights to the India network of California-based fashion brand Forever 21; and international brands portfolio, such as The Collective, Simon Carter, American Eagle, Ralph Lauren, Hackett London, Ted Baker, and Fred Perry. It operates 3091 brand stores and 377 Pantaloons stores, as well as 28,585 multi-brand outlets in approximately 900 cities in India. The company was formerly known as Pantaloons Fashion & Retail Limited and changed its name to Aditya Birla Fashion and Retail Limited in January 2016. Aditya Birla Fashion and Retail Limited was incorporated in 2007 and is based in Mumbai, India.",https://www.abfrl.com,26965,
BOOT,BOOT,"Boot Barn Holdings, Inc.",3598960520,USD,3199116006,3598960520,USD,true,"Boot Barn Holdings, Inc., a lifestyle retail chain, operates specialty retail stores in the United States. The company's specialty retail stores offer western and work-related footwear, apparel, and accessories for men, women, and kids. It offers boots, shirts, jackets, hats, belts and belt buckles, handbags, western-style jewelry, rugged footwear, outerwear, overalls, denim, and flame-resistant and high-visibility clothing. The company also provides gifts and home merchandise. As of May 10, 2022, it operated 304 stores in 38 states. The company also sells its products through e-commerce websites, including bootbarn.com; sheplers.com; and countryoutfitter.com. The company was formerly known as WW Top Investment Corporation and changed its name to Boot Barn Holdings, Inc. in June 2014. Boot Barn Holdings, Inc. was founded in 1978 and is based in Irvine, California.",https://www.bootbarn.com,3100,
ANF,ANF,Abercrombie & Fitch Co.,3485239976,USD,3098029814,3485239976,USD,true,"Abercrombie & Fitch Co., through its subsidiaries, operates as a specialty retailer. The company operates in two segments, Hollister and Abercrombie. It offers an assortment of apparel, personal care products, and accessories for men, women, and children under the Hollister, Abercrombie & Fitch, abercrombie kids, Moose, Seagull, Gilly Hicks, and Social Tourist brands. As of January 29, 2022, it operated approximately 729 retail stores in Europe, Asia, Canada, the Middle East, United States, and internationally. The company sells products through its stores; various third-party wholesale, franchise, and licensing arrangements; and e-commerce platforms. Abercrombie & Fitch Co. was founded in 1892 and is headquartered in New Albany, Ohio.",https://www.abercrombie.com,6600,
UNF,UNF,UniFirst Corporation,3285890663,USD,2920828210,3285890663,USD,true,"UniFirst Corporation provides workplace uniforms and protective work wear clothing in the United States, Europe, and Canada. The company operates through U.S. and Canadian Rental and Cleaning, Manufacturing, Specialty Garments Rental and Cleaning, and First Aid segments. It designs, manufactures, personalizes, rents, cleans, delivers, and sells a range of uniforms and protective clothing, including shirts, pants, jackets, coveralls, lab coats, smocks, and aprons; and specialized protective wear, such as flame resistant and high visibility garments. The company also rents and sells industrial wiping products, floor mats, facility service products, and dry and wet mops; restroom and cleaning supplies comprising air fresheners, paper products, gloves, masks, sanitizers, and hand soaps; and other textile products. In addition, it provides first aid cabinet services and other safety supplies; decontaminates and cleans work clothes, and other items that is exposed to radioactive materials; and services special cleanroom protective wear and facilities. Further, it offers a range of garment service options, including full-service rental programs in which garments are cleaned and serviced; lease programs in which garments are cleaned and maintained by individual employees; and purchase programs to buy garments and related items directly. The company serves automobile service centers and dealers, delivery services, food and general merchandise retailers, food processors and service operations, light manufacturers, maintenance facilities, restaurants, service companies, soft and durable goods wholesalers, transportation companies, healthcare providers, government agencies, research and development laboratories, high technology companies, and utilities operating nuclear reactors, as well as others who require employee clothing for image, identification, protection, or utility purposes. UniFirst Corporation was founded in 1936 and is headquartered in Wilmington, Massachusetts.",https://www.unifirst.com,16000,
M,M,"Macy's, Inc.",3237029880,USD,2877395860,3237029880,USD,true,"Macy's, Inc., an omni-channel retail organization, operates stores, Websites, and mobile applications. The company sells a range of merchandise, such as apparel and accessories for men, women, and children; cosmetics; home furnishings; and other consumer goods. As of January 29, 2022, it operated 725 department stores in the District of Columbia, Puerto Rico, and Guam under the Macy's, Macy's Backstage, Market by Macy's, Bloomingdale's, Bloomingdale's The Outlet, Bloomies, and bluemercury brands. It also operates in Dubai, the United Arab Emirates, and Al Zahra, Kuwait under the license agreements. The company also operates as a beauty products and spa retailer. The company was formerly known as Federated Department Stores, Inc. and changed its name to Macy's, Inc. in June 2007. Macy's, Inc. was founded in 1830 and is based in New York, New York.",https://www.macysinc.com,94189,
BOSS.DE,BOSS.DE,Hugo Boss AG,2708194393,EUR,2708194393,3046680608,EUR,true,"Hugo Boss AG, together with its subsidiaries, develops, markets, and distributes clothes, shoes, and accessories for men and women worldwide. It offers business, casual, athleisure, and evening wear; shoes and accessories; and licensed products, including fragrances, eyewear, and watches, as well as children's fashion products. The company markets and sells its products under the BOSS and HUGO brand names through online stores, freestanding stores, shop-in-shops, and factory outlets. As of December 31, 2021, it operated 1,228 retail points of sale. The company was founded in 1924 and is headquartered in Metzingen, Germany.",https://www.hugoboss.com,18623,
LREN3.SA,LREN3.SA,Lojas Renner S.A.,17038058400,BRL,2681410607,3018523943,BRL,true,"Lojas Renner S.A., together with its subsidiaries, operates as a fashion and lifestyle company in Brazil, Uruguay, and Argentina. The company operates in Retail and Financial Products segments. It engages in the trade of clothes and sports products, shoes, accessories, perfumery, domestic appliances, towels and linen, furniture, and decoration articles. The company owns and operates Renner stores, including 392 units in Brazil, 8 units in Brazil, and 4 in Argentina; 119 Camicado stores; 104 Youcom stores; and 114 Ashua stores. It also engages in the granting of withdrawals, and financing of purchases and insurance, as well as provides personal loans. The company was incorporated in 1965 and is headquartered in Porto Alegre, Brazil.",https://www.lojasrenner.com.br,25102,
600612.SS,600612.SS,"Lao Feng Xiang Co., Ltd.",21207662361,CNY,2604250561,2930894893,CNY,true,"Lao Feng Xiang Co., Ltd. operates in the jewelry industry in the People's Republic of China and internationally. It designs, produces, and sells gold, silver, platinum, diamonds, jade, pearls, gold inlays, colored gemstones, enamel, red coral, and other jewelry, as well as K gold glasses, and craft travel souvenirs. The company was formerly known as China First Pencil Co., Ltd. and changed its name to Lao Feng Xiang Co., Ltd. in July 2009. Lao Feng Xiang Co., Ltd. was founded in 1848 and is based in Shanghai, the People's Republic of China.",https://www.laofengxiang.com,2347,
6110.HK,6110.HK,Topsports International Holdings Limited,20215977200,HKD,2309675395,2598989149,HKD,true,"Topsports International Holdings Limited, an investment holding company, engages in the sale of sportswear products in the People's Republic of China. The company is also involved in the leasing of commercial spaces to other retailers for concessionaire sale; provision of information technology services; operation of sports cities business; and trading of sportswear products. As of February 28, 2022, it operated a network of 7,695 directly operated stores. The company also offers its products through e-commerce platform. Topsports International Holdings Limited was founded in 1999 and is headquartered in Kwai Chung, Hong Kong.",https://www.topsports.com.cn,28941,
UA,UA,"Under Armour, Inc.",2453345336,USD,2180778669,2453345336,USD,true,"Under Armour, Inc., together with its subsidiaries, engages in the developing, marketing, and distributing performance apparel, footwear, and accessories for men, women, and youth. The company offers its apparel in compression, fitted, and loose fit types. It also provides footwear products for running, training, basketball, cleated sports, recovery, and outdoor applications. In addition, the company offers accessories, which include gloves, bags, headwear, and sports masks; and digital subscription and advertising services under the MapMyRun and MapMyRide platforms. It primarily offers its products under the UNDER ARMOUR, UA, HEATGEAR, COLDGEAR, HOVR, PROTECT THIS HOUSE, I WILL, UA Logo, ARMOUR FLEECE, and ARMOUR BRA brands. The company sells its products through wholesale channels, including national and regional sporting goods chains, independent and specialty retailers, department store chains, mono-branded Under Armour retail stores, institutional athletic departments, and leagues and teams, as well as independent distributors; and directly to consumers through a network of 422 brand and factory house stores, as well as through e-commerce websites. It operates in the United States, Canada, Europe, the Middle East, Africa, the Asia-Pacific, and Latin America. Under Armour, Inc. was incorporated in 1996 and is headquartered in Baltimore, Maryland.",https://www.underarmour.com,6800,
002563.SZ,002563.SZ,"Zhejiang Semir Garment Co., Ltd.",15502300234,CNY,1903645644,2142414935,CNY,true,"Zhejiang Semir Garment Co., Ltd. produces and sells casual wear and children's wear in China. The company offers clothing, shoes, hats, etc., as well as knitwear and home textiles products. It offers its products under the Semir, Balabala, Marcolor, Mini Barra, Kidiliz, and other brands. The company offers its products through stores and online. Zhejiang Semir Garment Co., Ltd. was founded in 1996 and is based in Shanghai, China.",https://www.semir.com,3092,
ZGN,ZGN,Ermenegildo Zegna N.V.,2083785000,USD,1852276486,2083785000,USD,true,"Ermenegildo Zegna N.V., together with its subsidiaries, designs, manufactures, markets, and distributes luxury menswear, footwear, leather goods, and other accessories under the Zegna and the Thom Browne brands. It provides luxury leisurewear for men; formal suits, tuxedos, shirts, blazers, formal overcoats, and accessories; leather accessories comprising shoes, bags, belts, and small leather accessories; and fragrances. The company also offers luxury womenswear and childrenswear under the Thom Browne brand, as well as provides eyewear, cufflinks and jewelry, watches, underwear, and beachwear manufactured by third parties under licenses. It serves customers through its retail stores and online channels in Europe, the Middle East, Africa, North America, Latin America, the Asia Pacific, and internationally. The company was founded in 1910 and is based in Trivero, Italy. Ermenegildo Zegna N.V. is a subsidiary of Monterubello Societa' Semplice.",https://www.zegna.com,7185,
CPRI,CPRI,Capri Holdings Limited,1990320800,USD,1769196159,1990320800,USD,true,"Capri Holdings Limited designs, markets, distributes, and retails branded women's and men's apparel, footwear, and accessories in the United States, Canada, Latin America, Europe, the Middle East, Africa, and Asia. It operates through three segments: Versace, Jimmy Choo, and Michael Kors. The company offers ready-to-wear, accessories, footwear, handbags, scarves and belts, small leather goods, eyewear, watches, jewelry, fragrances, and home furnishings through a distribution network, including boutiques, department, and specialty stores, as well as through e-commerce sites. It also licenses Versace brand name and trademarks to third parties to retail and/or wholesale its products; and has licensing agreements to the manufacture and sale of jeans, fragrances, watches, eyewear, and home furnishings. The company was formerly known as Michael Kors Holdings Limited and changed its name to Capri Holdings Limited in December 2018. Capri Holdings Limited was founded in 1981 and is headquartered in London, the United Kingdom.",https://www.capriholdings.com,10200,
AEO,AEO,"American Eagle Outfitters, Inc.",1921805960,USD,1708293317,1921805960,USD,true,"American Eagle Outfitters, Inc. operates as a specialty retailer that provides clothing, accessories, and personal care products under the American Eagle and Aerie brands. The company provides jeans, and specialty apparel and accessories for women and men; and intimates, apparel, activewear, and swim collections, as well as personal care products for women. It also offers graphic tees and other clothing products under the Tailgate brand name; and menswear products under the Todd Snyder New York brand name. As of January 29, 2022, the company operated 880 American Eagle stores, 244 Aerie brand stand-alone stores, and five Todd Snyder stores in the United States, Canada, Mexico, and Hong Kong. It also ships to 81 countries through its Websites; and offers its merchandise at 260 locations operated by licensees in 28 countries, as well as provides products through its Websites ae.com, aerie.com, and toddsnyder.com. American Eagle Outfitters, Inc. was founded in 1977 and is headquartered in Pittsburgh, Pennsylvania.",https://www.aeo-inc.com,9000,
BKE,BKE,"The Buckle, Inc.",1888282381,USD,1678494208,1888282381,USD,true,"The Buckle, Inc. operates as a retailer of casual apparel, footwear, and accessories for young men and women in the United States. It markets a selection of brand name casual apparel, including denims, other casual bottoms, tops, sportswear, outerwear, accessories, and footwear, as well as private label merchandise primarily comprising BKE, Buckle Black, Salvage, Red by BKE, Daytrip, Gimmicks, Gilded Intent, FITZ + EDDI, Willow & Root, Outpost Makers, Departwest, Reclaim, BKE Vintage, Nova Industries, J.B. Holt, and Veece. The company also provides services, such as hemming, gift-packaging, layaways, guest loyalty program, the Buckle private label credit card, and personalized stylist services, as well as special order system that allows stores to obtain requested merchandise from other company stores or its online order fulfillment center. As of March 11, 2022, it operated 440 retail stores in 42 states under the Buckle and The Buckle names. The Buckle, Inc. also sells its products through its website, buckle.com. The company was formerly known as Mills Clothing, Inc. and changed its name to The Buckle, Inc. in April 1991. The Buckle, Inc. was incorporated in 1948 and is headquartered in Kearney, Nebraska.",https://www.buckle.com,2800,
