Symbol,Ticker,Name,Market Cap (Original),Original Currency,Market Cap (EUR),Market Cap (USD),Exchange,Active,Description,Homepage URL,Employees,Timestamp
TPR,TPR,"Tapestry, Inc.",16149240150,USD,14355059569,16149240150,USD,true,"Tapestry, Inc. provides luxury accessories and branded lifestyle products in the United States, Japan, Greater China, and internationally. The company operates in three segments: Coach, Kate Spade, and Stuart Weitzman. It offers women's accessories, including handbags, such as wallets, money pieces, wristlets, and cosmetic cases; novelty accessories comprising address books, time management and travel accessories, sketchbooks, and portfolios; and key rings and charms. The company also provides bag collections, including business cases, computer bags, messenger-style bags, backpacks, and totes; small leather goods, such as wallets, card cases, travel organizers, and belts; and footwear, watches, fragrances, sunglasses, novelty accessories, and ready-to-wear for men. In addition, it offers women's footwear; sunglasses; bracelets, necklaces, rings, and earrings; fragrances and watches; women's seasonal lifestyle apparel collections, including outerwear and ready-to-wear, and cold weather accessories, which comprise gloves, scarves, and hats. Further, the company provides footwear items; and housewares and home accessories for kids, such as fashion bedding and tableware; and stationery and gifts. Additionally, it licenses rights to market and distribute its tech and soft accessories, jewelry, watches, eyewear, and fragrances under the Coach brand; and tableware and housewares, fashion beddings, tech accessories, watches, sleepwear, eyewear, stationery and gifts, and fragrances under the Kate Spade brand. As of July 2, 2022, the company operated through a network of 945 Coach stores, 398 Kate Spade stores, and 100 Stuart Weitzman stores. It sells its products through e-commerce sites and concession shop-in-shops, and wholesale customers, as well as through independent third-party distributors. The company was formerly known as Coach, Inc. and changed its name to Tapestry, Inc. in October 2017. Tapestry, Inc. was founded in 1941 and is headquartered in New York, New York.",https://www.tapestry.com,12500,
ONON,ONON,On Holding AG,16004177643,USD,14226113506,16004177643,USD,true,"On Holding AG develops and distributes sports products worldwide. It offers athletic footwear, apparel, and accessories. The company offers its products through independent retailers and distributors, online, and stores. On Holding AG was founded in 2010 and is headquartered in Zurich, Switzerland.",https://www.on-running.com,3254,
7936.T,7936.T,ASICS Corporation,2294643243068,JPY,14034038074,15785715957,JPY,true,"ASICS Corporation manufactures and sells sports goods in Japan, the Americas, Europe, Oceania, Southeast and South Asia, and internationally. It offers sports shoes, apparel, and equipment. The company sells its products under the ASICS, ASICSTIGER, and Onitsuka Tiger brands through 989 retail stores, as well as through online. ASICS Corporation was founded in 1949 and is headquartered in Kobe, Japan.",https://corp.asics.com/jp,8987,
RL,RL,Ralph Lauren Corporation,15363230590,USD,13656375671,15363230590,USD,true,"Ralph Lauren Corporation designs, markets, and distributes lifestyle products in North America, Europe, Asia, and internationally. The company offers apparel, including a range of men's, women's, and children's clothing; footwear and accessories, which comprise casual shoes, dress shoes, boots, sneakers, sandals, eyewear, watches, fashion and fine jewelry, scarves, hats, gloves, and umbrellas, as well as leather goods, such as handbags, luggage, small leather goods, and belts; home products consisting of bed and bath lines, furniture, fabric and wallcoverings, lighting, tabletop, kitchen linens, floor coverings, and giftware; and fragrances. It sells apparel and accessories under the Ralph Lauren Collection, Ralph Lauren Purple Label, Polo Ralph Lauren, Double RL, Lauren Ralph Lauren, Polo Golf Ralph Lauren, Ralph Lauren Golf, RLX Ralph Lauren, Polo Ralph Lauren Children, and Chaps brands; women's fragrances under the Ralph Lauren Collection, Woman by Ralph Lauren, Romance Collection, and Ralph Collection brand names; and men's fragrances under the Polo Blue, Ralph's Club, Safari, Purple Label, Polo Red, Polo Green, Polo Black, Polo Sport, and Big Pony Men's brand names. The company's restaurant collection includes The Polo Bar in New York City; RL Restaurant in Chicago; Ralph's in Paris; The Bar at Ralph Lauren located in Milan; and Ralph's Coffee concept. It sells its products to department stores, specialty stores, and golf and pro shops, as well as directly to consumers through its retail stores, concession-based shop-within-shops, and its digital commerce sites. The company directly operates 504 retail stores and 684 concession-based shop-within-shops; and operates 175 Ralph Lauren stores, 329 factory stores, and 148 stores and shops through licensing partners. Ralph Lauren Corporation was founded in 1967 and is headquartered in New York, New York.",https://www.ralphlauren.com,14800,
DKS,DKS,"DICK'S Sporting Goods, Inc.",15280827584,USD,13583127639,15280827584,USD,true,"DICK'S Sporting Goods, Inc., together with its subsidiaries, operates as a sporting goods retailer primarily in the eastern United States. The company provides hardlines, including sporting goods equipment, fitness equipment, golf equipment, and hunting and fishing gear products; apparel; and footwear and accessories. It also owns and operates Sporting Goods, Golf Galaxy, Field & Stream, Public Lands, Going Going Gone!, and other specialty concept stores; and DICK'S House of Sports and Golf Galaxy Performance Center, as well as GameChanger, a youth sports mobile application for video streaming, scorekeeping, scheduling, and communications. The company sells its product through e-commerce websites and mobile applications. As of January 29, 2022, it operated 730 DICK'S Sporting Goods stores. The company was formerly known as Dick'S Clothing and Sporting Goods, Inc. and changed its name to DICK'S Sporting Goods, Inc. in April 1999. DICK'S Sporting Goods, Inc. was incorporated in 1948 and is headquartered in Coraopolis, Pennsylvania.",https://www.dickssportinggoods.com,18600,
BURL,BURL,"Burlington Stores, Inc.",15074089038,USD,13399357745,15074089038,USD,true,"Burlington Stores, Inc. operates as a retailer of branded apparel products in the United States. The company provides fashion-focused merchandise, including women's ready-to-wear apparel, menswear, youth apparel, footwear, accessories, toys, gifts, and coats, as well as baby, home, and beauty products. As of January 29, 2022, it operated 837 stores under the Burlington Stores name, 2 stores under the Cohoes Fashions name, and 1 store under the MJM Designer Shoes name in 45 states and Puerto Rico. Burlington Stores, Inc. was founded in 1972 and is headquartered in Burlington, New Jersey.",https://www.burlingtoninvestors.com,17057,
1929.HK,1929.HK,Chow Tai Fook Jewellery Group Limited,108666611200,HKD,12415160329,13970303815,HKD,true,"Chow Tai Fook Jewellery Group Limited, an investment holding company, manufactures and sells jewelry products. The company offers gem-set, platinum and k-gold jewelry, and k-gold jewelry and products under the CHOW TAI FOOK, HEARTS ON FIRE, T MARK, ENZO, MONOLOGUE, and SOINLOVE brands. It also distributes watches of various brands. In addition, the company is involved in the trading of diamonds; and the provision of services to franchisees. The company also sells its products through online platforms. As of March 31, 2022, it had 5,902 points of sale in Mainland China, Hong Kong, Macau, Taiwan, Cambodia, Korea, Japan, Malaysia, the Philippines, Singapore, Thailand, the United States, and Vietnam. The company was founded in 1929 and is headquartered in Central, Hong Kong. Chow Tai Fook Jewellery Group Limited is a subsidiary of Chow Tai Fook Capital Limited.",https://www.ctfjewellerygroup.com,26500,
DOCS,DOCS,"Doximity, Inc.",11106269603,USD,9872363050,11106269603,USD,true,"Doximity, Inc. operates a cloud-based digital platform for medical professionals in the United States. The company's platform provides its members with tools built for medical professionals, enabling them to collaborate with their colleagues, coordinate patient care, conduct virtual patient visits, stay up to date with the latest medical news and research, and manage their careers. It primarily serves pharmaceutical manufacturers and healthcare systems. The company was formerly known as 3MD Communications, Inc. and changed its name to Doximity, Inc. in June 2010. Doximity, Inc. was incorporated in 2010 and is headquartered in San Francisco, California.",https://www.doximity.com,827,
BIRK,BIRK,Birkenstock Holding plc,9877938154,USD,8780499225,9877938154,USD,true,"Birkenstock Holding plc manufactures and sells footwear products. It also offers sandals, shoes, closed-toe silhouettes, skincare products, and accessories. The company sells its products through e-commerce sites and a network of owned retail stores, as well as business-to-business channels. It operates in the United States, Brazil, Canada, Mexico, Europe, APMA, and internationally. Birkenstock Holding plc was founded in 1774 and is based in London, the United Kingdom. Birkenstock Holding plc is a subsidiary of BK LC Lux MidCo S.à r.l.",https://www.birkenstock-holding.com,6200,
ZAL.DE,ZAL.DE,Zalando SE,8204335499,EUR,8204335499,9229762064,EUR,true,"Zalando SE operates an online platform for fashion and lifestyle products. It provides clothing, footwear, accessories, and beauty products with free delivery and returns. The company also sells its products through its Zalando Lounge; and brick-and-mortar outlet stores in Berlin, Frankfurt, Cologne, Leipzig, Hamburg, Hanover, Münster, Stuttgart, Mannheim, and Ulm. It serves customers in 23 countries, including Austria, Belgium, Croatia, Czechia, Denmark, Estonia, Finland, France, Germany, Ireland, Italy, Latvia, Lithuania, Luxembourg, the Netherlands, Norway, Poland, Slovakia, Slovenia, Spain, Sweden, Switzerland, and the United Kingdom. The company was founded in 2008 and is headquartered in Berlin, Germany.",https://corporate.zalando.de,15463,
SKX,SKX,"Skechers U.S.A., Inc.",9199096095,USD,8177076518,9199096095,USD,true,"Skechers U.S.A., Inc. designs, develops, markets, and distributes footwear for men, women, and children; and performance footwear for men and women worldwide. The company operates through three segments: Domestic Wholesale, International Wholesale, and Direct-to-Consumer. It offers casual, casual athletic, sport athletic, trail, sandals, boots, and retro fashion footwear for men and women under the Skechers USA, Skechers Sport, Skechers Active, Modern Comfort, Skechers Street, Mark Nason, and BOBS brands; sneakers, casuals, boots, and sandals for boys and girls under the Skechers Mega-Craft, S-Lights, SKECH-AIR, Foamies, Twinkle Toes, Z-Strap, Skechers Stretch Fit, and Skechers Street brands; and technical footwear under the Skechers GOrun, Skechers GOwalk, Skechers GOtrain, Skechers GOtrail, and Skechers GO Golf brands. The company also provides men's and women's slip-resistant and safety-toe casuals, boots, hikers, and athletic shoes; and lifestyle apparel for men, women, and kids. As of December 31, 2021, it operated 4,306 company and third party owned Skechers stores. The company sells its products through department and specialty stores, athletic and independent retailers, boutiques, and online retailers; and through its e-commerce sites, concept stores, and factory and warehouse outlet stores. It also licenses its Skechers brand. Skechers U.S.A., Inc. was incorporated in 1992 and is headquartered in Manhattan Beach, California.",https://www.skechers.com,10100,
UHR.SW,UHR.SW,The Swatch Group AG,7122138412,CHF,7611643185,8572214159,CHF,true,"The Swatch Group AG designs, manufactures, and sells finished watches, jewelry, and watch movements and components worldwide. It operates through Watches & Jewelry and Electronic Systems segments. The Watches & Jewelry segment designs, produces, and commercializes watches and jewelry. The Electronic Systems segment is involved in the design, production, and commercialization of electronic components, as well as sports timing activities. It is also involved in the provision of assembly, research and development, administration, watch case polishing, logistics and distribution, and customer services; and hard material products, microelectronics, watch cases and crowns, miniature low-frequency quartz crystals, thin wires, miniature batteries, watch dials and bracelets, watch hands, sports timing technology and equipment, precision parts, and assembly electronic components. In addition, the company engages in retail, communication, real estate project and property management, finance, reinsurance, and art center businesses. It offers its watch and jewelry products primarily under the Breguet, Harry Winston, Blancpain, Glashütte Original, Jaquet Droz, Léon Hatot, Omega, Longines, Rado, Union Glashütte, Tissot, Balmain, Certina, Mido, Hamilton, Calvin Klein, Swatch, and Flik Flak brands. The Swatch Group AG was founded in 1983 and is headquartered in Biel/Bienne, Switzerland.",https://www.swatchgroup.com,32477,
GAP,GAP,"The Gap, Inc.",8533846640,USD,7585736278,8533846640,USD,true,"The Gap, Inc. operates as an apparel retail company. The company offers apparel, accessories, and personal care products for men, women, and children under the Old Navy, Gap, Banana Republic, and Athleta brands. Its products include denim, tees, fleece, and khakis; eyewear, jewelry, shoes, handbags, and fragrances; and fitness and lifestyle products for use in yoga, training, sports, travel, and everyday activities for women and girls. The company offers its products through company-operated stores, franchise stores, Websites, third-party arrangements, and catalogs. It has franchise agreements with unaffiliated franchisees to operate Old Navy, Gap, Athleta, and Banana Republic stores and websites in Asia, Europe, Latin America, the Middle East, and Africa. As of December 31, 2021, the company had 2,835 company-operated stores and 564 franchise stores. It also provides its products through e-commerce sites. The Gap, Inc. was incorporated in 1969 and is headquartered in San Francisco, California.",https://www.gapinc.com,82000,
LPP.WA,LPP.WA,LPP SA,30436596000,PLN,7190645805,8102165788,PLN,true,"LPP SA designs, manufactures, distributes, and retails clothing for women, men, and children. It offers apparel, accessories, and footwear under the Reserved, Cropp, House, Mohito, and Sinsay brands. The company sells its products through 2,244 stores, as well as through online stores in Poland and internationally. LPP SA was founded in 1989 and is headquartered in Gdansk, Poland.",https://www.lppsa.com,22296,
BC.MI,BC.MI,Brunello Cucinelli S.p.A.,6934297500,EUR,6934297500,7800987175,EUR,true,"Brunello Cucinelli S.p.A., together with its subsidiaries, engages in the production and sale of clothing, accessories, and lifestyle products in Italy, Europe, North America, Japan, and China. The company offers women's collection, including coats and jackets, dresses, knitwear, t-shirts and tops, shirts, skirts, pants, denim, travel wear, sneakers, high-boots, loafers and flat shoes, sandals, leather goods, jewelry, scarves, other accessories, mini bags and clutches, crossbody bags and backpacks, and handbags and shoppers. It also provides men's collection, such as coats and jackets, knitwear, blazers and waistcoats, suits, tuxedos, t-shirts and polos, shirts, pants, denims, travel wear, sneakers, lace-ups, loafers, boots, leather goods, bags, scarves, and other accessories; and kids collections. In addition, the company offers lifestyle products, which include throw and blanket, cushion, studio products, candle and fragrance, bathrobe and towel, gardening products, travel essential, leisure bag, leisure wear, kitchen and table ware, table linen, and ceramic creation products, China, and internationally. As of December 31, 2021, it managed and operated 114 directly operated stores; and 30 wholesale monobrand boutiques. The company was founded in 1978 and is headquartered in Solomeo, Italy. Brunello Cucinelli S.p.A. is a subsidiary of Fedone S.r.l.",https://www.brunellocucinelli.com,3165,
GIL.TO,GIL.TO,Gildan Activewear Inc.,9942912000,CAD,6339363953,7134695752,CAD,true,"Gildan Activewear Inc. manufactures and sells various apparel products in the United States, North America, Europe, Asia-Pacific, and Latin America. It provides various activewear products, including T-shirts, fleece tops and bottoms, and sports shirts under the Gildan, Gildan Performance, Gildan Hammer, Comfort Colors, American Apparel, Alstyle, and GoldToe brands. The company also offers hosiery products comprising athletic; dress; and casual, liner, therapeutic, and workwear socks, as well as sheer pantyhose, tights, and leggings under the Gildan, Under Armour, GoldToe, PowerSox, Signature Gold by Goldtoe, Peds, MediPeds, Therapy Plus, All Pro, Secret, Silks, Secret Silky, and American Apparel brands. In addition, it provides men's and boys' underwear products, and ladies panties under the Gildan and Gildan Platinum brands; and ladies' shapewear, intimates, and accessories under the Secret and Secret Silky brands. The company sells its products to wholesale distributors, screen printers, and embellishers, as well as to retailers and lifestyle brand companies. The company was formerly known as Textiles Gildan Inc. and changed its name to Gildan Activewear Inc. in March 1995. Gildan Activewear Inc. was founded in 1946 and is headquartered in Montreal, Canada.",https://gildancorp.com,50000,
LEVI,LEVI,Levi Strauss & Co.,6803595500,USD,6047716039,6803595500,USD,true,"Levi Strauss & Co. operates as an apparel company. The company designs, markets, and sells jeans, casual and dress pants, activewear, tops, shorts, skirts, dresses, jackets, footwear, and related accessories for men, women, and children in the Americas, Europe, and Asia. It also sells its products under the Levi's, Dockers, Signature by Levi Strauss & Co., and Denizen brands. In addition, the company licenses Levi's and Dockers trademarks for various product categories, including footwear, belts, wallets and bags, outerwear, sweaters, dress shirts, kids wear, sleepwear, and hosiery. Further, it sells its products through third-party retailers, such as department stores, specialty retailers, third-party e-commerce sites, and franchisees who operate brand-dedicated stores; and directly to consumers through various formats, including company-operated mainline and outlet stores, company-operated e-commerce sites, and select shop-in-shops located in department stores, and other third-party retail locations. The company also operates approximately 3,100 brand-dedicated stores and shop-in-shops. The company was founded in 1853 and is headquartered in San Francisco, California.",https://www.levistrauss.com,18700,
BBWI,BBWI,"Bath & Body Works, Inc.",6613867350,USD,5879066687,6613867350,USD,true,"Bath & Body Works, Inc. operates a specialty retailer of home fragrance, body care, and soaps and sanitizer products. The company sells its products under the Bath & Body Works, White Barn, and other brand names through specialty retail stores and websites located in the United States and Canada, as well as through international stores operated by partners under franchise, license, and wholesale arrangements. As of January 29, 2022, it operated 1,755 company-operated retail stores and 338 international partner-operated stores. The company was formerly known as L Brands, Inc. and changed its name to Bath & Body Works, Inc. in August 2021. Bath & Body Works, Inc. was founded in 1963 and is headquartered in Columbus, Ohio.",https://www.bbwinc.com,8975,
CROX,CROX,"Crocs, Inc.",6154090395,USD,5470370952,6154090395,USD,true,"Crocs, Inc., together with its subsidiaries, designs, develops, manufactures, markets, and distributes casual lifestyle footwear and accessories for men, women, and children. It offers various footwear products, including clogs, sandals, slides, flip-flops, boots, flats, wedges, platforms, socks, shoe charms, loafers, sneakers, and slippers under the Crocs brand name. The company sells its products in approximately 85 countries through wholesalers, retail stores, e-commerce sites, and third-party marketplaces. As of December 31, 2021, it had 193 outlet stores, 107 retail stores, 373 company-operated stores, 73 kiosks and store-in-stores, and 14 company-operated e-commerce sites. The company serves in the Americas, the Asia Pacific, Europe, the Middle East, and Africa. Crocs, Inc. was founded in 1999 and is headquartered in Broomfield, Colorado.",https://www.crocs.com,7910,
3998.HK,3998.HK,Bosideng International Holdings Limited,46502428000,HKD,5312902399,5978405327,HKD,true,"Bosideng International Holdings Limited researches, designs, develops, manufactures, markets, and distributes branded down apparel products, original equipment manufacturing (OEM) products, and non-down apparel products in the People's Republic of China. The company operates through four segments: Down Apparels, OEM Management, Ladieswear Apparels, and Diversified Apparels. It engages in the business of sourcing and distributing branded down and ladieswear apparels; and non-seasonal apparels, including branded menswear, school uniform, and children's wear. The company provides down apparel products under the Bosideng, Snow Flying, Bengen, etc. brands; ladies wear products under the JESSIE, BUOU BUOU, KOREANO, and KLOVA brands; and school uniforms under the Sameite brand. It also offers network consulting and e-business of down and non-down apparel; logistics and storage services; and brand design and development services, as well as operates as an advertisement agency. As of March 31, 2022, it operated 462 ladieswear retail outlets; 364 self-operated retail outlets; and 98 retail outlets operated by third party distributors. Bosideng International Holdings Limited was founded in 1976 and is based in Central, Hong Kong.",https://www.bosideng.com,13082,
DDS,DDS,"Dillard's, Inc.",5653602897,USD,5025487615,5653602897,USD,true,"Dillard's, Inc. operates retail department stores in the southeastern, southwestern, and midwestern areas of the United States. Its stores offer merchandise, including fashion apparel for women, men, and children; and accessories, cosmetics, home furnishings, and other consumer goods. As of January 29, 2022, the company operated 280 Dillard's stores, including 30 clearance centers, and an Internet store at dillards.com. It also engages in the general contracting construction activities. The company was founded in 1938 and is based in Little Rock, Arkansas.",https://www.dillards.com,22800,
VFC,VFC,V.F. Corporation,5173529440,USD,4598750319,5173529440,USD,true,"V.F. Corporation, together with its subsidiaries, engages in the design, procurement, marketing, and distribution of branded lifestyle apparel, footwear, and related products for men, women, and children in the Americas, Europe, and the Asia-Pacific. It operates through three segments: Outdoor, Active, and Work. The company offers outdoor, merino wool and other natural fibers-based, lifestyle, and casual apparel; footwear; equipment; accessories; outdoor-inspired, performance-based, youth culture/action sports-inspired, streetwear, and protective work footwear; handbags, luggage, backpacks, and totes; and work and work-inspired lifestyle apparel and footwear. It provides its products under the North Face, Timberland, Smartwool, Icebreaker, Altra, Vans, Supreme, Kipling, Napapijri, Eastpak, JanSport, Dickies, and Timberland PRO brand names. The company sells its products primarily to specialty stores, department stores, national chains, and mass merchants, as well as sells through direct-to-consumer operations, including retail stores, concession retail stores, and e-commerce sites, and other digital platforms. V.F. Corporation was founded in 1899 and is headquartered in Denver, Colorado.",https://www.vfc.com,18000,
2331.HK,2331.HK,Li Ning Company Limited,39610451760,HKD,4525494113,5092364979,HKD,true,"Li Ning Company Limited engages in the research and development, design, manufacture, marketing, distribution, and retail of sporting goods in the People's Republic of China. The company offers sporting goods, including footwear, apparel, equipment, and accessories for professional and leisure purposes primarily under the LI-NING brand. It also develops, manufactures, markets, distributes, and/or sells outdoor sports products under the AIGLE brand; table tennis under the Double Happiness brand name; fashionable fitness products for dance and yoga under the Danskin brand; and badminton under the Kason brand name. As of December 31, 2021, the company operated 7,137 conventional stores, flagship stores, China LI-NING stores, factory outlets, and multi-brand stores under the LI-NING brand. Li Ning Company Limited was founded in 1990 and is headquartered in Beijing, the People's Republic of China.",https://www.lining.com,5022,
